id,event_name,total_area,total_heat,total_pm25,total_pm10,total_pm,total_co,total_co2,total_ch4,total_nmhc,total_nox,total_nh3,total_so2,total_voc,total_bc,total_h2,total_nmoc,total_no,total_no2,total_oc,total_tpc,total_tpm
SF11E4347313,"Unnamed fire in Mono County, California",24793.999938421523,0,0,0,0,0,0,0,0,0,0,0,0,0,0,0,0,0,0,0,0
SF11E4368569,"Unnamed fire in Tulare County, California",11637.999971095824,0,0,0,0,0,0,0,0,0,0,0,0,0,0,0,0,0,0,0,0
SF11E4371429,"Unnamed fire in Coconino County, Arizona",11189.99997220847,0,0,0,0,0,0,0,0,0,0,0,0,0,0,0,0,0,0,0,0
SF11E4371630,"Unnamed fire in Garfield County, Utah",10119.999974865925,0,0,0,0,0,0,0,0,0,0,0,0,0,0,0,0,0,0,0,0
SF11E4376816,"Unnamed fire in Yavapai County, Arizona",26399.99993443285,0,0,0,0,0,0,0,0,0,0,0,0,0,0,0,0,0,0,0,0
SF11E4379716,"Unnamed fire in Mckinley County, New Mexico",1049.9999973922156,0,0,0,0,0,0,0,0,0,0,0,0,0,0,0,0,0,0,0,0
SF11E4383204,"Unnamed fire in Baker County, Oregon",26633.99993385168,0,0,0,0,0,0,0,0,0,0,0,0,0,0,0,0,0,0,0,0
SF11E4391128,"Unnamed fire in Division No. 18, Ab, Canada",499.9999987581982,0,0,0,0,0,0,0,0,0,0,0,0,0,0,0,0,0,0,0,0
SF11E4391668,"Unnamed fire in Idaho County, Idaho",4369.9999891466505,0,0,0,0,0,0,0,0,0,0,0,0,0,0,0,0,0,0,0,0
SF11E4393303,"Unnamed fire in Bonneville County, Idaho",5703.999985833525,0,0,0,0,0,0,0,0,0,0,0,0,0,0,0,0,0,0,0,0
SF11E4395146,"Unnamed fire in Dillingham County, Alaska",2999.9999925491884,0,0,0,0,0,0,0,0,0,0,0,0,0,0,0,0,0,0,0,0
SF11E4396610,"Unnamed fire in Carbon County, Wyoming",207999.99948341033,0,0,0,0,0,0,0,0,0,0,0,0,0,0,0,0,0,0,0,0
SF11E4396925,"Unnamed fire in Converse County, Wyoming",2999.999992549188,0,0,0,0,0,0,0,0,0,0,0,0,0,0,0,0,0,0,0,0
SF11E4397010,"Unnamed fire in Tamuin, San Luis Potosi, Mexico",999.9999975163961,0,0,0,0,0,0,0,0,0,0,0,0,0,0,0,0,0,0,0,0
SF11E4397037,"Unnamed fire in Custer County, Idaho",1379.9999965726265,0,0,0,0,0,0,0,0,0,0,0,0,0,0,0,0,0,0,0,0
SF11E4397115,"Unnamed fire in Panuco, Veracruz, Mexico",3999.999990065585,0,0,0,0,0,0,0,0,0,0,0,0,0,0,0,0,0,0,0,0
SF11E4397937,"Unnamed fire in Kitimat-stikine Regional District, Bc, Canada",499.99999875819805,0,0,0,0,0,0,0,0,0,0,0,0,0,0,0,0,0,0,0,0
SF11E4399251,"Unnamed fire in Soto La Marina, Tamaulipas, Mexico",8499.999978889366,0,0,0,0,0,0,0,0,0,0,0,0,0,0,0,0,0,0,0,0
SF11E4399397,"Unnamed fire in Lafayette County, Florida",499.99999875819805,0,0,0,0,0,0,0,0,0,0,0,0,0,0,0,0,0,0,0,0
SF11E4400646,"Unnamed fire in Jefferson County, Montana",4139.99998971788,0,0,0,0,0,0,0,0,0,0,0,0,0,0,0,0,0,0,0,0
SF11E4400651,"Unnamed fire in Clearwater County, Idaho",4369.9999891466505,0,0,0,0,0,0,0,0,0,0,0,0,0,0,0,0,0,0,0,0
SF11E4400756,"Unnamed fire in Valdez-cordova County, Alaska",14999.999962745944,0,0,0,0,0,0,0,0,0,0,0,0,0,0,0,0,0,0,0,0
SF11E4400824,"Unnamed fire in Lassen County, California",229.99999942877108,0,0,0,0,0,0,0,0,0,0,0,0,0,0,0,0,0,0,0,0
SF11E4400825,"Unnamed fire in Atchison County, Missouri",999.9999975163961,0,0,0,0,0,0,0,0,0,0,0,0,0,0,0,0,0,0,0,0
SF11E4400932,"Unnamed fire in Yukon, Yt, Canada",4999.9999875819785,0,0,0,0,0,0,0,0,0,0,0,0,0,0,0,0,0,0,0,0
SF11E4401020,"Unnamed fire in Yukon, Yt, Canada",999.9999975163961,0,0,0,0,0,0,0,0,0,0,0,0,0,0,0,0,0,0,0,0
SF11E4401149,"Unnamed fire in Yukon, Yt, Canada",1999.9999950327922,0,0,0,0,0,0,0,0,0,0,0,0,0,0,0,0,0,0,0,0
SF11E4401178,"Unnamed fire in Madison County, Mississippi",499.99999875819805,0,0,0,0,0,0,0,0,0,0,0,0,0,0,0,0,0,0,0,0
SF11E4401182,"Unnamed fire in Division No. 17, Ab, Canada",10499.999973922158,0,0,0,0,0,0,0,0,0,0,0,0,0,0,0,0,0,0,0,0
SF11E4401256,"Unnamed fire in Mitchell County, Georgia",2499.99999379099,0,0,0,0,0,0,0,0,0,0,0,0,0,0,0,0,0,0,0,0
SF11E4401271,"Unnamed fire in Bulkley-nechako Regional District, Bc, Canada",499.99999875819805,0,0,0,0,0,0,0,0,0,0,0,0,0,0,0,0,0,0,0,0
SF11E4402134,"Unnamed fire in Mexicali, Baja California, Mexico",999.9999975163958,0,0,0,0,0,0,0,0,0,0,0,0,0,0,0,0,0,0,0,0
SF11E4403390,"Unnamed fire in Chelan County, Washington",229.9999994287711,0,0,0,0,0,0,0,0,0,0,0,0,0,0,0,0,0,0,0,0
SF11E4403440,"Unnamed fire in Division No. 17, Ab, Canada",1999.9999950327922,0,0,0,0,0,0,0,0,0,0,0,0,0,0,0,0,0,0,0,0
SF11E4403499,"Unnamed fire in Granite County, Montana",689.9999982863133,0,0,0,0,0,0,0,0,0,0,0,0,0,0,0,0,0,0,0,0
SF11E4403504,"Unnamed fire in Park County, Wyoming",413.99999897178805,0,0,0,0,0,0,0,0,0,0,0,0,0,0,0,0,0,0,0,0
SF11E4403673,"Unnamed fire in Choctaw County, Mississippi",1829.9999954550049,0,0,0,0,0,0,0,0,0,0,0,0,0,0,0,0,0,0,0,0
SF11E4403735,"Unnamed fire in Milam County, Texas",1499.999996274594,0,0,0,0,0,0,0,0,0,0,0,0,0,0,0,0,0,0,0,0
SF11E4403851,"Unnamed fire in Box Elder County, Utah",999.9999975163961,0,0,0,0,0,0,0,0,0,0,0,0,0,0,0,0,0,0,0,0
SF11E4403906,"Unnamed fire in Yukon, Yt, Canada",999.9999975163961,0,0,0,0,0,0,0,0,0,0,0,0,0,0,0,0,0,0,0,0
SF11E4403923,"Unnamed fire in Lincoln County, Mississippi",699.9999982614771,0,0,0,0,0,0,0,0,0,0,0,0,0,0,0,0,0,0,0,0
SF11E4404006,"Unnamed fire in Chilton County, Alabama",609.9999984850016,0,0,0,0,0,0,0,0,0,0,0,0,0,0,0,0,0,0,0,0
SF11E4404015,"Unnamed fire in Lincoln County, Mississippi",559.9999986091817,0,0,0,0,0,0,0,0,0,0,0,0,0,0,0,0,0,0,0,0
SF11E4404022,"Unnamed fire in Yukon, Yt, Canada",499.99999875819805,0,0,0,0,0,0,0,0,0,0,0,0,0,0,0,0,0,0,0,0
SF11E4404112,"Unnamed fire in Yukon, Yt, Canada",2499.99999379099,0,0,0,0,0,0,0,0,0,0,0,0,0,0,0,0,0,0,0,0
SF11E4404126,"Unnamed fire in Pontotoc County, Mississippi",699.9999982614771,0,0,0,0,0,0,0,0,0,0,0,0,0,0,0,0,0,0,0,0
SF11E4404133,"Unnamed fire in Washington County, Mississippi",499.99999875819805,0,0,0,0,0,0,0,0,0,0,0,0,0,0,0,0,0,0,0,0
SF11E4406273,"Unnamed fire in Coconino County, Arizona",909.9999977399202,0,0,0,0,0,0,0,0,0,0,0,0,0,0,0,0,0,0,0,0
SF11E4406430,"Unnamed fire in Decatur County, Georgia",499.99999875819805,0,0,0,0,0,0,0,0,0,0,0,0,0,0,0,0,0,0,0,0
SF11E4406477,"Unnamed fire in Division No. 17, Ab, Canada",2499.99999379099,0,0,0,0,0,0,0,0,0,0,0,0,0,0,0,0,0,0,0,0
SF11E4406663,"Unnamed fire in Division No. 17, Ab, Canada",3499.999991307386,0,0,0,0,0,0,0,0,0,0,0,0,0,0,0,0,0,0,0,0
SF11E4406809,"Unnamed fire in Chesterfield County, South Carolina",699.9999982614771,0,0,0,0,0,0,0,0,0,0,0,0,0,0,0,0,0,0,0,0
SF11E4406820,"Unnamed fire in Mississippi County, Arkansas",1499.999996274594,0,0,0,0,0,0,0,0,0,0,0,0,0,0,0,0,0,0,0,0
SF11E4406856,"Unnamed fire in Dougherty County, Georgia",374.9999990686485,0,0,0,0,0,0,0,0,0,0,0,0,0,0,0,0,0,0,0,0
SF11E4406868,"Unnamed fire in Randolph County, Georgia",499.99999875819805,0,0,0,0,0,0,0,0,0,0,0,0,0,0,0,0,0,0,0,0
SF11E4406889,"Unnamed fire in Bradley County, Tennessee",499.99999875819805,0,0,0,0,0,0,0,0,0,0,0,0,0,0,0,0,0,0,0,0
SF11E4406898,"Unnamed fire in Gonzalez, Tamaulipas, Mexico",2999.999992549188,0,0,0,0,0,0,0,0,0,0,0,0,0,0,0,0,0,0,0,0
SF11E4406928,"Unnamed fire in Aransas County, Texas",499.99999875819805,0,0,0,0,0,0,0,0,0,0,0,0,0,0,0,0,0,0,0,0
SF11E4406972,"Unnamed fire in Prince George County, Virginia",349.99999913073856,0,0,0,0,0,0,0,0,0,0,0,0,0,0,0,0,0,0,0,0
SF11E4406985,"Unnamed fire in Washington County, Mississippi",499.99999875819805,0,0,0,0,0,0,0,0,0,0,0,0,0,0,0,0,0,0,0,0
SF11E4406997,"Unnamed fire in Madison County, Florida",349.99999913073856,0,0,0,0,0,0,0,0,0,0,0,0,0,0,0,0,0,0,0,0
SF11E4407002,"Unnamed fire in Franklin County, Tennessee",999.9999975163961,0,0,0,0,0,0,0,0,0,0,0,0,0,0,0,0,0,0,0,0
SF11E4407044,"Unnamed fire in East Carroll County, Louisiana",499.99999875819805,0,0,0,0,0,0,0,0,0,0,0,0,0,0,0,0,0,0,0,0
SF11E4407059,"Unnamed fire in Talladega County, Alabama",499.99999875819805,0,0,0,0,0,0,0,0,0,0,0,0,0,0,0,0,0,0,0,0
SF11E4407062,"Unnamed fire in Division No.  8, Mb, Canada",999.9999975163961,0,0,0,0,0,0,0,0,0,0,0,0,0,0,0,0,0,0,0,0
SF11E4407150,"Unnamed fire in West Carroll County, Louisiana",999.9999975163961,0,0,0,0,0,0,0,0,0,0,0,0,0,0,0,0,0,0,0,0
SF11E4407161,"Unnamed fire in Rio Bravo, Tamaulipas, Mexico",499.99999875819805,0,0,0,0,0,0,0,0,0,0,0,0,0,0,0,0,0,0,0,0
SF11E4407183,"Unnamed fire in Etchojoa, Sonora, Mexico",499.99999875819805,0,0,0,0,0,0,0,0,0,0,0,0,0,0,0,0,0,0,0,0
SF11E4407218,"Unnamed fire in Rio Arriba County, New Mexico",349.99999913073856,0,0,0,0,0,0,0,0,0,0,0,0,0,0,0,0,0,0,0,0
SF11E4407604,"Unnamed fire in Etchojoa, Sonora, Mexico",999.9999975163961,0,0,0,0,0,0,0,0,0,0,0,0,0,0,0,0,0,0,0,0
SF11E4407622,"Unnamed fire in Yukon, Yt, Canada",12499.999968954946,0,0,0,0,0,0,0,0,0,0,0,0,0,0,0,0,0,0,0,0
SF11E4409047,"Unnamed fire in Grayson County, Virginia",1999.9999950327922,0,0,0,0,0,0,0,0,0,0,0,0,0,0,0,0,0,0,0,0
SF11E4409070,"Unnamed fire in Bear Lake County, Idaho",399.9999990065584,0,0,0,0,0,0,0,0,0,0,0,0,0,0,0,0,0,0,0,0
SF11E4409076,"Unnamed fire in Clarke County, Alabama",699.9999982614771,0,0,0,0,0,0,0,0,0,0,0,0,0,0,0,0,0,0,0,0
SF11E4409086,"Unnamed fire in Randolph County, Alabama",609.9999984850016,0,0,0,0,0,0,0,0,0,0,0,0,0,0,0,0,0,0,0,0
SF11E4409100,"Unnamed fire in St. Helena County, Louisiana",349.99999913073856,0,0,0,0,0,0,0,0,0,0,0,0,0,0,0,0,0,0,0,0
SF11E4409101,"Unnamed fire in Stillwater County, Montana",349.99999913073856,0,0,0,0,0,0,0,0,0,0,0,0,0,0,0,0,0,0,0,0
SF11E4409134,"Unnamed fire in Yukon, Yt, Canada",999.9999975163961,0,0,0,0,0,0,0,0,0,0,0,0,0,0,0,0,0,0,0,0
SF11E4409137,"Unnamed fire in Sampson County, North Carolina",1124.9999972059456,0,0,0,0,0,0,0,0,0,0,0,0,0,0,0,0,0,0,0,0
SF11E4409144,"Unnamed fire in Pershing County, Nevada",3499.999991307386,0,0,0,0,0,0,0,0,0,0,0,0,0,0,0,0,0,0,0,0
SF11E4409147,"Unnamed fire in Stormont, On, Canada",499.99999875819805,0,0,0,0,0,0,0,0,0,0,0,0,0,0,0,0,0,0,0,0
SF11E4409151,"Unnamed fire in Caroline County, Virginia",374.9999990686485,0,0,0,0,0,0,0,0,0,0,0,0,0,0,0,0,0,0,0,0
SF11E4409157,"Unnamed fire in Chatham-kent Division, On, Canada",499.99999875819805,0,0,0,0,0,0,0,0,0,0,0,0,0,0,0,0,0,0,0,0
SF11E4409165,"Unnamed fire in Attala County, Mississippi",1829.9999954550049,0,0,0,0,0,0,0,0,0,0,0,0,0,0,0,0,0,0,0,0
SF11E4409217,"Unnamed fire in Jackson County, Mississippi",349.99999913073856,0,0,0,0,0,0,0,0,0,0,0,0,0,0,0,0,0,0,0,0
SF11E4409230,"Unnamed fire in Todd County, Kentucky",1999.9999950327922,0,0,0,0,0,0,0,0,0,0,0,0,0,0,0,0,0,0,0,0
SF11E4409270,"Unnamed fire in Yukon, Yt, Canada",2999.999992549188,0,0,0,0,0,0,0,0,0,0,0,0,0,0,0,0,0,0,0,0
SF11E4409277,"Unnamed fire in Bay County, Florida",1399.9999965229542,0,0,0,0,0,0,0,0,0,0,0,0,0,0,0,0,0,0,0,0
SF11E4409289,"Unnamed fire in Colbert County, Alabama",609.9999984850016,0,0,0,0,0,0,0,0,0,0,0,0,0,0,0,0,0,0,0,0
SF11E4409348,"Unnamed fire in San Saba County, Texas",21999.999945360716,0,0,0,0,0,0,0,0,0,0,0,0,0,0,0,0,0,0,0,0
SF11E4409362,"Unnamed fire in Houston County, Texas",1399.9999965229542,0,0,0,0,0,0,0,0,0,0,0,0,0,0,0,0,0,0,0,0
SF11E4409364,"Unnamed fire in St. James County, Louisiana",374.9999990686485,0,0,0,0,0,0,0,0,0,0,0,0,0,0,0,0,0,0,0,0
SF11E4409419,"Unnamed fire in Blount County, Alabama",609.9999984850016,0,0,0,0,0,0,0,0,0,0,0,0,0,0,0,0,0,0,0,0
SF11E4409477,"Unnamed fire in Yukon, Yt, Canada",1999.999995032792,0,0,0,0,0,0,0,0,0,0,0,0,0,0,0,0,0,0,0,0
SF11E4409505,"Unnamed fire in Jefferson County, Arkansas",1999.9999950327913,0,0,0,0,0,0,0,0,0,0,0,0,0,0,0,0,0,0,0,0
SF11E4409513,"Unnamed fire in Hidalgo, Tamaulipas, Mexico",499.99999875819805,0,0,0,0,0,0,0,0,0,0,0,0,0,0,0,0,0,0,0,0
SF11E4409514,"Unnamed fire in Rankin County, Mississippi",349.99999913073856,0,0,0,0,0,0,0,0,0,0,0,0,0,0,0,0,0,0,0,0
SF11E4409516,"Unnamed fire in Soto La Marina, Tamaulipas, Mexico",2999.999992549188,0,0,0,0,0,0,0,0,0,0,0,0,0,0,0,0,0,0,0,0
SF11E4409520,"Unnamed fire in Tulare County, California",2499.99999379099,0,0,0,0,0,0,0,0,0,0,0,0,0,0,0,0,0,0,0,0
SF11E4409547,"Unnamed fire in Chicot County, Arkansas",1499.999996274594,0,0,0,0,0,0,0,0,0,0,0,0,0,0,0,0,0,0,0,0
SF11E4409554,"Unnamed fire in Sharkey County, Mississippi",7499.999981372967,0,0,0,0,0,0,0,0,0,0,0,0,0,0,0,0,0,0,0,0
SF11E4409585,"Unnamed fire in Tensas County, Louisiana",999.9999975163961,0,0,0,0,0,0,0,0,0,0,0,0,0,0,0,0,0,0,0,0
SF11E4409607,"Unnamed fire in Madison County, Louisiana",499.99999875819805,0,0,0,0,0,0,0,0,0,0,0,0,0,0,0,0,0,0,0,0
SF11E4409611,"Unnamed fire in East Carroll County, Louisiana",1499.999996274594,0,0,0,0,0,0,0,0,0,0,0,0,0,0,0,0,0,0,0,0
SF11E4409616,"Unnamed fire in Red River County, Louisiana",4829.999988004192,0,0,0,0,0,0,0,0,0,0,0,0,0,0,0,0,0,0,0,0
SF11E4409664,"Unnamed fire in Tulare County, California",999.9999975163961,0,0,0,0,0,0,0,0,0,0,0,0,0,0,0,0,0,0,0,0
SF11E4409679,"Unnamed fire in Yukon, Yt, Canada",1999.9999950327915,0,0,0,0,0,0,0,0,0,0,0,0,0,0,0,0,0,0,0,0
SF11E4409690,"Unnamed fire in Macon County, Georgia",349.99999913073856,0,0,0,0,0,0,0,0,0,0,0,0,0,0,0,0,0,0,0,0
SF11E4409691,"Unnamed fire in Caroline County, Maryland",499.99999875819805,0,0,0,0,0,0,0,0,0,0,0,0,0,0,0,0,0,0,0,0
SF11E4409697,"Unnamed fire in Decatur County, Georgia",499.99999875819805,0,0,0,0,0,0,0,0,0,0,0,0,0,0,0,0,0,0,0,0
SF11E4409698,"Unnamed fire in Kern County, California",3999.9999900655844,0,0,0,0,0,0,0,0,0,0,0,0,0,0,0,0,0,0,0,0
SF11E4409742,"Unnamed fire in Aldama, Tamaulipas, Mexico",1499.999996274594,0,0,0,0,0,0,0,0,0,0,0,0,0,0,0,0,0,0,0,0
SF11E4409774,"Unnamed fire in Ashley County, Arkansas",499.99999875819805,0,0,0,0,0,0,0,0,0,0,0,0,0,0,0,0,0,0,0,0
SF11E4409779,"Unnamed fire in Lamar County, Mississippi",349.99999913073856,0,0,0,0,0,0,0,0,0,0,0,0,0,0,0,0,0,0,0,0
SF11E4409786,"Unnamed fire in Lee County, Georgia",499.99999875819805,0,0,0,0,0,0,0,0,0,0,0,0,0,0,0,0,0,0,0,0
SF11E4409787,"Unnamed fire in Aldama, Tamaulipas, Mexico",499.99999875819805,0,0,0,0,0,0,0,0,0,0,0,0,0,0,0,0,0,0,0,0
SF11E4409792,"Unnamed fire in Otero County, New Mexico",1749.999995653693,0,0,0,0,0,0,0,0,0,0,0,0,0,0,0,0,0,0,0,0
SF11E4409793,"Unnamed fire in Riverside County, California",999.9999975163961,0,0,0,0,0,0,0,0,0,0,0,0,0,0,0,0,0,0,0,0
SF11E4409819,"Unnamed fire in Sunflower County, Mississippi",2999.999992549189,0,0,0,0,0,0,0,0,0,0,0,0,0,0,0,0,0,0,0,0
SF11E4409842,"Unnamed fire in Edwards County, Texas",1499.999996274594,0,0,0,0,0,0,0,0,0,0,0,0,0,0,0,0,0,0,0,0
SF11E4409942,"Unnamed fire in Bolivar County, Mississippi",1499.999996274594,0,0,0,0,0,0,0,0,0,0,0,0,0,0,0,0,0,0,0,0
SF11E4410124,"Unnamed fire in Desha County, Arkansas",3499.999991307386,0,0,0,0,0,0,0,0,0,0,0,0,0,0,0,0,0,0,0,0
SF11E4410462,"Unnamed fire in Gustavo Diaz Ordaz, Tamaulipas, Mexico",3499.999991307386,0,0,0,0,0,0,0,0,0,0,0,0,0,0,0,0,0,0,0,0
SF11E4410937,"Unnamed fire in Desoto County, Mississippi",899.9999977647565,0,0,0,0,0,0,0,0,0,0,0,0,0,0,0,0,0,0,0,0
SF11E4410965,"Unnamed fire in Tulare County, California",11399.999971686917,0,0,0,0,0,0,0,0,0,0,0,0,0,0,0,0,0,0,0,0
SF11E4410995,"Unnamed fire in Copiah County, Mississippi",1469.9999963491018,0,0,0,0,0,0,0,0,0,0,0,0,0,0,0,0,0,0,0,0
SF11E4411020,"Unnamed fire in Yazoo County, Mississippi",3293.9999918190088,0,0,0,0,0,0,0,0,0,0,0,0,0,0,0,0,0,0,0,0
SF11E4411045,"Unnamed fire in San Juan County, New Mexico",3399.9999915557464,0,0,0,0,0,0,0,0,0,0,0,0,0,0,0,0,0,0,0,0
SF11E4411050,"Unnamed fire in Walker County, Alabama",2073.9999948490054,0,0,0,0,0,0,0,0,0,0,0,0,0,0,0,0,0,0,0,0
SF11E4411075,"Unnamed fire in Natchitoches County, Louisiana",6369.999984179443,0,0,0,0,0,0,0,0,0,0,0,0,0,0,0,0,0,0,0,0
SF11E4411102,"Unnamed fire in Florence County, South Carolina",1649.9999959020536,0,0,0,0,0,0,0,0,0,0,0,0,0,0,0,0,0,0,0,0
SF11E4411106,"Unnamed fire in Aldama, Tamaulipas, Mexico",899.9999977647565,0,0,0,0,0,0,0,0,0,0,0,0,0,0,0,0,0,0,0,0
SF11E4411154,"Unnamed fire in San Juan County, New Mexico",1399.9999965229545,0,0,0,0,0,0,0,0,0,0,0,0,0,0,0,0,0,0,0,0
SF11E4411173,"Unnamed fire in Jefferson County, Mississippi",1189.9999970445112,0,0,0,0,0,0,0,0,0,0,0,0,0,0,0,0,0,0,0,0
SF11E4411180,"Unnamed fire in Aldama, Tamaulipas, Mexico",1699.9999957778728,0,0,0,0,0,0,0,0,0,0,0,0,0,0,0,0,0,0,0,0
SF11E4411224,"Unnamed fire in Trigg County, Kentucky",799.9999980131169,0,0,0,0,0,0,0,0,0,0,0,0,0,0,0,0,0,0,0,0
SF11E4411225,"Unnamed fire in Tulare County, California",399.9999990065584,0,0,0,0,0,0,0,0,0,0,0,0,0,0,0,0,0,0,0,0
SF11E4411226,"Unnamed fire in Lauderdale County, Alabama",399.9999990065584,0,0,0,0,0,0,0,0,0,0,0,0,0,0,0,0,0,0,0,0
SF11E4411227,"Unnamed fire in Union County, Illinois",487.9999987880013,0,0,0,0,0,0,0,0,0,0,0,0,0,0,0,0,0,0,0,0
SF11E4411228,"Unnamed fire in Wayne County, Tennessee",399.9999990065584,0,0,0,0,0,0,0,0,0,0,0,0,0,0,0,0,0,0,0,0
SF11E4411229,"Unnamed fire in Cibola County, New Mexico",319.99999920524675,0,0,0,0,0,0,0,0,0,0,0,0,0,0,0,0,0,0,0,0
SF11E4411230,"Unnamed fire in Kern County, California",399.9999990065584,0,0,0,0,0,0,0,0,0,0,0,0,0,0,0,0,0,0,0,0
SF11E4411231,"Unnamed fire in Division No. 14, Sk, Canada",3599.999991059026,0,0,0,0,0,0,0,0,0,0,0,0,0,0,0,0,0,0,0,0
SF11E4411232,"Unnamed fire in Monroe County, Mississippi",279.99999930459086,0,0,0,0,0,0,0,0,0,0,0,0,0,0,0,0,0,0,0,0
SF11E4411233,"Unnamed fire in Montgomery County, Mississippi",975.9999975760026,0,0,0,0,0,0,0,0,0,0,0,0,0,0,0,0,0,0,0,0
SF11E4411234,"Unnamed fire in Hancock County, Kentucky",799.9999980131169,0,0,0,0,0,0,0,0,0,0,0,0,0,0,0,0,0,0,0,0
SF11E4411235,"Unnamed fire in Calhoun County, Mississippi",609.9999984850016,0,0,0,0,0,0,0,0,0,0,0,0,0,0,0,0,0,0,0,0
SF11E4411236,"Unnamed fire in Imperial County, California",999.9999975163961,0,0,0,0,0,0,0,0,0,0,0,0,0,0,0,0,0,0,0,0
SF11E4411237,"Unnamed fire in Izard County, Arkansas",609.9999984850016,0,0,0,0,0,0,0,0,0,0,0,0,0,0,0,0,0,0,0,0
SF11E4411238,"Unnamed fire in Lincoln County, Mississippi",1049.9999973922158,0,0,0,0,0,0,0,0,0,0,0,0,0,0,0,0,0,0,0,0
SF11E4411239,"Unnamed fire in Sussex County, Delaware",499.99999875819805,0,0,0,0,0,0,0,0,0,0,0,0,0,0,0,0,0,0,0,0
SF11E4411240,"Unnamed fire in Logan County, Kentucky",1499.999996274594,0,0,0,0,0,0,0,0,0,0,0,0,0,0,0,0,0,0,0,0
SF11E4411241,"Unnamed fire in Perry County, Alabama",1219.9999969700032,0,0,0,0,0,0,0,0,0,0,0,0,0,0,0,0,0,0,0,0
SF11E4411242,"Unnamed fire in Aransas County, Texas",499.99999875819805,0,0,0,0,0,0,0,0,0,0,0,0,0,0,0,0,0,0,0,0
SF11E4411243,"Unnamed fire in White County, Arkansas",999.9999975163961,0,0,0,0,0,0,0,0,0,0,0,0,0,0,0,0,0,0,0,0
SF11E4411244,"Unnamed fire in Union County, New Mexico",2249.9999944118913,0,0,0,0,0,0,0,0,0,0,0,0,0,0,0,0,0,0,0,0
SF11E4411245,"Unnamed fire in Ensenada, Baja California, Mexico",499.99999875819805,0,0,0,0,0,0,0,0,0,0,0,0,0,0,0,0,0,0,0,0
SF11E4411246,"Unnamed fire in Claiborne County, Mississippi",499.99999875819805,0,0,0,0,0,0,0,0,0,0,0,0,0,0,0,0,0,0,0,0
SF11E4411247,"Unnamed fire in Claiborne County, Mississippi",999.9999975163961,0,0,0,0,0,0,0,0,0,0,0,0,0,0,0,0,0,0,0,0
SF11E4411248,"Unnamed fire in Haywood County, North Carolina",499.99999875819805,0,0,0,0,0,0,0,0,0,0,0,0,0,0,0,0,0,0,0,0
SF11E4411249,"Unnamed fire in Juneau County, Wisconsin",999.9999975163961,0,0,0,0,0,0,0,0,0,0,0,0,0,0,0,0,0,0,0,0
SF11E4411250,"Unnamed fire in Gonzalez, Tamaulipas, Mexico",499.99999875819805,0,0,0,0,0,0,0,0,0,0,0,0,0,0,0,0,0,0,0,0
SF11E4411251,"Unnamed fire in Daviess County, Kentucky",499.99999875819805,0,0,0,0,0,0,0,0,0,0,0,0,0,0,0,0,0,0,0,0
SF11E4411252,"Unnamed fire in Red River County, Texas",1499.999996274594,0,0,0,0,0,0,0,0,0,0,0,0,0,0,0,0,0,0,0,0
SF11E4411253,"Unnamed fire in Panola County, Texas",349.99999913073856,0,0,0,0,0,0,0,0,0,0,0,0,0,0,0,0,0,0,0,0
SF11E4411254,"Unnamed fire in General Bravo, Nuevo Leon, Mexico",999.9999975163961,0,0,0,0,0,0,0,0,0,0,0,0,0,0,0,0,0,0,0,0
SF11E4411255,"Unnamed fire in Yukon, Yt, Canada",499.99999875819805,0,0,0,0,0,0,0,0,0,0,0,0,0,0,0,0,0,0,0,0
SF11E4411256,"Unnamed fire in La Salle County, Louisiana",349.99999913073856,0,0,0,0,0,0,0,0,0,0,0,0,0,0,0,0,0,0,0,0
SF11E4411257,"Unnamed fire in Franklin County, Alabama",609.9999984850016,0,0,0,0,0,0,0,0,0,0,0,0,0,0,0,0,0,0,0,0
SF11E4411258,"Unnamed fire in Allen County, Louisiana",349.99999913073856,0,0,0,0,0,0,0,0,0,0,0,0,0,0,0,0,0,0,0,0
SF11E4411259,"Unnamed fire in Johnson County, Illinois",499.99999875819805,0,0,0,0,0,0,0,0,0,0,0,0,0,0,0,0,0,0,0,0
SF11E4411260,"Unnamed fire in Soto La Marina, Tamaulipas, Mexico",1499.999996274594,0,0,0,0,0,0,0,0,0,0,0,0,0,0,0,0,0,0,0,0
SF11E4411261,"Unnamed fire in Terrell County, Georgia",999.9999975163961,0,0,0,0,0,0,0,0,0,0,0,0,0,0,0,0,0,0,0,0
SF11E4411262,"Unnamed fire in Berks County, Pennsylvania",499.99999875819805,0,0,0,0,0,0,0,0,0,0,0,0,0,0,0,0,0,0,0,0
SF11E4411263,"Unnamed fire in Wilkes County, Georgia",349.99999913073856,0,0,0,0,0,0,0,0,0,0,0,0,0,0,0,0,0,0,0,0
SF11E4411264,"Unnamed fire in Lincoln County, Tennessee",999.9999975163961,0,0,0,0,0,0,0,0,0,0,0,0,0,0,0,0,0,0,0,0
SF11E4411265,"Unnamed fire in Campbell County, Wyoming",749.999998137297,0,0,0,0,0,0,0,0,0,0,0,0,0,0,0,0,0,0,0,0
SF11E4411266,"Unnamed fire in Livingston County, Michigan",999.9999975163961,0,0,0,0,0,0,0,0,0,0,0,0,0,0,0,0,0,0,0,0
SF11E4411267,"Unnamed fire in Montgomery County, Texas",699.9999982614771,0,0,0,0,0,0,0,0,0,0,0,0,0,0,0,0,0,0,0,0
SF11E4411268,"Unnamed fire in Henderson County, Tennessee",609.9999984850016,0,0,0,0,0,0,0,0,0,0,0,0,0,0,0,0,0,0,0,0
SF11E4411269,"Unnamed fire in Attala County, Mississippi",609.9999984850016,0,0,0,0,0,0,0,0,0,0,0,0,0,0,0,0,0,0,0,0
SF11E4411270,"Unnamed fire in Jefferson County, Arkansas",374.9999990686485,0,0,0,0,0,0,0,0,0,0,0,0,0,0,0,0,0,0,0,0
SF11E4411271,"Unnamed fire in Sumter County, Alabama",374.9999990686485,0,0,0,0,0,0,0,0,0,0,0,0,0,0,0,0,0,0,0,0
SF11E4411272,"Unnamed fire in Acadia County, Louisiana",374.9999990686485,0,0,0,0,0,0,0,0,0,0,0,0,0,0,0,0,0,0,0,0
SF11E4411273,"Unnamed fire in Tensas County, Louisiana",1499.999996274594,0,0,0,0,0,0,0,0,0,0,0,0,0,0,0,0,0,0,0,0
SF11E4411274,"Unnamed fire in Amelia County, Virginia",1399.9999965229542,0,0,0,0,0,0,0,0,0,0,0,0,0,0,0,0,0,0,0,0
SF11E4411275,"Unnamed fire in Hopkins County, Kentucky",609.9999984850016,0,0,0,0,0,0,0,0,0,0,0,0,0,0,0,0,0,0,0,0
SF11E4411276,"Unnamed fire in Irwin County, Georgia",499.99999875819805,0,0,0,0,0,0,0,0,0,0,0,0,0,0,0,0,0,0,0,0
SF11E4411277,"Unnamed fire in Tangipahoa County, Louisiana",374.9999990686485,0,0,0,0,0,0,0,0,0,0,0,0,0,0,0,0,0,0,0,0
SF11E4411278,"Unnamed fire in Ohio County, Kentucky",499.99999875819805,0,0,0,0,0,0,0,0,0,0,0,0,0,0,0,0,0,0,0,0
SF11E4411279,"Unnamed fire in Brazoria County, Texas",499.99999875819805,0,0,0,0,0,0,0,0,0,0,0,0,0,0,0,0,0,0,0,0
SF11E4411280,"Unnamed fire in Washington County, Mississippi",4999.99998758198,0,0,0,0,0,0,0,0,0,0,0,0,0,0,0,0,0,0,0,0
SF11E4411281,"Unnamed fire in Washington County, Mississippi",999.9999975163961,0,0,0,0,0,0,0,0,0,0,0,0,0,0,0,0,0,0,0,0
SF11E4411282,"Unnamed fire in Greene County, Alabama",609.9999984850016,0,0,0,0,0,0,0,0,0,0,0,0,0,0,0,0,0,0,0,0
SF11E4411283,"Unnamed fire in Allen County, Louisiana",4199.999989568863,0,0,0,0,0,0,0,0,0,0,0,0,0,0,0,0,0,0,0,0
SF11E4411284,"Unnamed fire in Utah County, Utah",499.99999875819805,0,0,0,0,0,0,0,0,0,0,0,0,0,0,0,0,0,0,0,0
SF11E4411285,"Unnamed fire in Coconino County, Arizona",349.99999913073856,0,0,0,0,0,0,0,0,0,0,0,0,0,0,0,0,0,0,0,0
SF11E4411286,"Unnamed fire in Matagorda County, Texas",499.99999875819805,0,0,0,0,0,0,0,0,0,0,0,0,0,0,0,0,0,0,0,0
SF11E4411287,"Unnamed fire in Lincoln County, Mississippi",349.99999913073856,0,0,0,0,0,0,0,0,0,0,0,0,0,0,0,0,0,0,0,0
SF11E4411288,"Unnamed fire in Rutherford County, Tennessee",499.99999875819805,0,0,0,0,0,0,0,0,0,0,0,0,0,0,0,0,0,0,0,0
SF11E4411289,"Unnamed fire in Mcnairy County, Tennessee",499.99999875819805,0,0,0,0,0,0,0,0,0,0,0,0,0,0,0,0,0,0,0,0
SF11E4411290,"Unnamed fire in Franklin County, Mississippi",1049.9999973922158,0,0,0,0,0,0,0,0,0,0,0,0,0,0,0,0,0,0,0,0
SF11E4411291,"Unnamed fire in Robertson County, Texas",499.99999875819805,0,0,0,0,0,0,0,0,0,0,0,0,0,0,0,0,0,0,0,0
SF11E4411292,"Unnamed fire in Edwards County, Texas",499.99999875819805,0,0,0,0,0,0,0,0,0,0,0,0,0,0,0,0,0,0,0,0
SF11E4411293,"Unnamed fire in Chilton County, Alabama",609.9999984850016,0,0,0,0,0,0,0,0,0,0,0,0,0,0,0,0,0,0,0,0
SF11E4411294,"Unnamed fire in Gonzalez, Tamaulipas, Mexico",2499.99999379099,0,0,0,0,0,0,0,0,0,0,0,0,0,0,0,0,0,0,0,0
SF11E4411295,"Unnamed fire in Imperial County, California",3999.9999900655844,0,0,0,0,0,0,0,0,0,0,0,0,0,0,0,0,0,0,0,0
SF11E4411296,"Unnamed fire in Harney County, Oregon",12999.999967713149,0,0,0,0,0,0,0,0,0,0,0,0,0,0,0,0,0,0,0,0
SF11E4411297,"Unnamed fire in East Baton Rouge County, Louisiana",1499.999996274594,0,0,0,0,0,0,0,0,0,0,0,0,0,0,0,0,0,0,0,0
SF11E4411298,"Unnamed fire in Peach County, Georgia",609.9999984850016,0,0,0,0,0,0,0,0,0,0,0,0,0,0,0,0,0,0,0,0
SF11E4411299,"Unnamed fire in Louisa County, Virginia",4269.999989395012,0,0,0,0,0,0,0,0,0,0,0,0,0,0,0,0,0,0,0,0
SF11E4411300,"Unnamed fire in Rio Bravo, Tamaulipas, Mexico",499.99999875819805,0,0,0,0,0,0,0,0,0,0,0,0,0,0,0,0,0,0,0,0
SF11E4411301,"Unnamed fire in Lee County, Virginia",1219.9999969700032,0,0,0,0,0,0,0,0,0,0,0,0,0,0,0,0,0,0,0,0
SF11E4411302,"Unnamed fire in Kitimat-stikine Regional District, Bc, Canada",1499.999996274594,0,0,0,0,0,0,0,0,0,0,0,0,0,0,0,0,0,0,0,0
SF11E4411303,"Unnamed fire in Etchojoa, Sonora, Mexico",999.9999975163961,0,0,0,0,0,0,0,0,0,0,0,0,0,0,0,0,0,0,0,0
SF11E4411304,"Unnamed fire in Buckingham County, Virginia",609.9999984850016,0,0,0,0,0,0,0,0,0,0,0,0,0,0,0,0,0,0,0,0
SF11E4411305,"Unnamed fire in Escambia County, Alabama",349.99999913073856,0,0,0,0,0,0,0,0,0,0,0,0,0,0,0,0,0,0,0,0
SF11E4411306,"Unnamed fire in Henry County, Ohio",499.99999875819805,0,0,0,0,0,0,0,0,0,0,0,0,0,0,0,0,0,0,0,0
SF11E4411307,Unknown Fire,499.99999875819805,0,0,0,0,0,0,0,0,0,0,0,0,0,0,0,0,0,0,0,0
SF11E4411308,"Unnamed fire in Bullock County, Alabama",1829.9999954550049,0,0,0,0,0,0,0,0,0,0,0,0,0,0,0,0,0,0,0,0
SF11E4411309,"Unnamed fire in Covington County, Mississippi",349.99999913073856,0,0,0,0,0,0,0,0,0,0,0,0,0,0,0,0,0,0,0,0
