SF11E4411310,"Unnamed fire in Ciudad Del Maiz, San Luis Potosi, Mexico",499.99999875819805,0,0,0,0,0,0,0,0,0,0,0,0,0,0,0,0,0,0,0,0
SF11E4411311,"Unnamed fire in Moore County, Tennessee",2439.9999939400063,0,0,0,0,0,0,0,0,0,0,0,0,0,0,0,0,0,0,0,0
SF11E4411312,"Unnamed fire in Lincoln County, North Carolina",499.99999875819805,0,0,0,0,0,0,0,0,0,0,0,0,0,0,0,0,0,0,0,0
SF11E4411313,"Unnamed fire in Lowndes County, Alabama",1499.999996274594,0,0,0,0,0,0,0,0,0,0,0,0,0,0,0,0,0,0,0,0
SF11E4411314,"Unnamed fire in Pershing County, Nevada",499.99999875819805,0,0,0,0,0,0,0,0,0,0,0,0,0,0,0,0,0,0,0,0
SF11E4411315,"Unnamed fire in Tulsa County, Oklahoma",499.99999875819805,0,0,0,0,0,0,0,0,0,0,0,0,0,0,0,0,0,0,0,0
SF11E4411316,"Unnamed fire in Santa Cruz County, Arizona",1499.999996274594,0,0,0,0,0,0,0,0,0,0,0,0,0,0,0,0,0,0,0,0
SF11E4411317,"Unnamed fire in Nueces County, Texas",499.99999875819805,0,0,0,0,0,0,0,0,0,0,0,0,0,0,0,0,0,0,0,0
SF11E4411318,"Unnamed fire in Cumberland County, North Carolina",499.99999875819805,0,0,0,0,0,0,0,0,0,0,0,0,0,0,0,0,0,0,0,0
SF11E4411319,"Unnamed fire in Chatham County, North Carolina",609.9999984850016,0,0,0,0,0,0,0,0,0,0,0,0,0,0,0,0,0,0,0,0
SF11E4411320,"Unnamed fire in Cheatham County, Tennessee",1219.9999969700032,0,0,0,0,0,0,0,0,0,0,0,0,0,0,0,0,0,0,0,0
SF11E4411321,"Unnamed fire in Converse County, Wyoming",749.999998137297,0,0,0,0,0,0,0,0,0,0,0,0,0,0,0,0,0,0,0,0
SF11E4411322,"Unnamed fire in Wayne County, New York",499.99999875819805,0,0,0,0,0,0,0,0,0,0,0,0,0,0,0,0,0,0,0,0
SF11E4411323,"Unnamed fire in Ohio County, Kentucky",999.9999975163961,0,0,0,0,0,0,0,0,0,0,0,0,0,0,0,0,0,0,0,0
SF11E4411324,"Unnamed fire in Tensas County, Louisiana",999.9999975163961,0,0,0,0,0,0,0,0,0,0,0,0,0,0,0,0,0,0,0,0
SF11E4411325,"Unnamed fire in Coahoma County, Mississippi",999.9999975163961,0,0,0,0,0,0,0,0,0,0,0,0,0,0,0,0,0,0,0,0
SF11E4411326,"Unnamed fire in Gulf County, Florida",349.99999913073856,0,0,0,0,0,0,0,0,0,0,0,0,0,0,0,0,0,0,0,0
SF11E4411327,"Unnamed fire in Leflore County, Mississippi",1499.999996274594,0,0,0,0,0,0,0,0,0,0,0,0,0,0,0,0,0,0,0,0
SF11E4411328,"Unnamed fire in Scotland County, Missouri",3499.999991307386,0,0,0,0,0,0,0,0,0,0,0,0,0,0,0,0,0,0,0,0
SF11E4411329,"Unnamed fire in Lamar County, Georgia",1219.9999969700032,0,0,0,0,0,0,0,0,0,0,0,0,0,0,0,0,0,0,0,0
SF11E4411330,"Unnamed fire in Alameda County, California",749.999998137297,0,0,0,0,0,0,0,0,0,0,0,0,0,0,0,0,0,0,0,0
SF11E4411331,"Unnamed fire in Yuma County, Arizona",499.99999875819805,0,0,0,0,0,0,0,0,0,0,0,0,0,0,0,0,0,0,0,0
SF11E4411332,"Unnamed fire in Lake County, Florida",1499.999996274594,0,0,0,0,0,0,0,0,0,0,0,0,0,0,0,0,0,0,0,0
SF11E4411333,"Unnamed fire in Altamira, Tamaulipas, Mexico",499.99999875819805,0,0,0,0,0,0,0,0,0,0,0,0,0,0,0,0,0,0,0,0
SF11E4411334,"Unnamed fire in Crane County, Texas",1499.999996274594,0,0,0,0,0,0,0,0,0,0,0,0,0,0,0,0,0,0,0,0
SF11E4411335,"Unnamed fire in Panola County, Mississippi",3499.999991307386,0,0,0,0,0,0,0,0,0,0,0,0,0,0,0,0,0,0,0,0
SF11E4411336,"Unnamed fire in Rio Bravo, Tamaulipas, Mexico",499.99999875819805,0,0,0,0,0,0,0,0,0,0,0,0,0,0,0,0,0,0,0,0
SF11E4411337,"Unnamed fire in Prince Of Wales-outer Ketchikan County, Alaska",1499.999996274594,0,0,0,0,0,0,0,0,0,0,0,0,0,0,0,0,0,0,0,0
SF11E4411338,"Unnamed fire in Anahuac, Nuevo Leon, Mexico",499.99999875819805,0,0,0,0,0,0,0,0,0,0,0,0,0,0,0,0,0,0,0,0
SF11E4411339,"Unnamed fire in Starr County, Texas",1499.999996274594,0,0,0,0,0,0,0,0,0,0,0,0,0,0,0,0,0,0,0,0
SF11E4411340,"Unnamed fire in Carter County, Tennessee",609.9999984850016,0,0,0,0,0,0,0,0,0,0,0,0,0,0,0,0,0,0,0,0
SF11E4411341,"Unnamed fire in Leflore County, Mississippi",1999.9999950327922,0,0,0,0,0,0,0,0,0,0,0,0,0,0,0,0,0,0,0,0
SF11E4411342,"Unnamed fire in Cherokee County, South Carolina",1499.999996274594,0,0,0,0,0,0,0,0,0,0,0,0,0,0,0,0,0,0,0,0
SF11E4411343,"Unnamed fire in Yukon, Yt, Canada",1999.9999950327922,0,0,0,0,0,0,0,0,0,0,0,0,0,0,0,0,0,0,0,0
SF11E4411344,"Unnamed fire in Arkansas County, Arkansas",999.9999975163961,0,0,0,0,0,0,0,0,0,0,0,0,0,0,0,0,0,0,0,0
SF11E4411345,"Unnamed fire in Ottawa County, Michigan",499.99999875819805,0,0,0,0,0,0,0,0,0,0,0,0,0,0,0,0,0,0,0,0
SF11E4411346,"Unnamed fire in Lawrence County, Arkansas",609.9999984850016,0,0,0,0,0,0,0,0,0,0,0,0,0,0,0,0,0,0,0,0
SF11E4411347,"Unnamed fire in Missoula County, Montana",459.9999988575422,0,0,0,0,0,0,0,0,0,0,0,0,0,0,0,0,0,0,0,0
SF11E4411348,"Unnamed fire in Sussex County, Delaware",999.9999975163961,0,0,0,0,0,0,0,0,0,0,0,0,0,0,0,0,0,0,0,0
SF11E4411349,"Unnamed fire in Bell County, Texas",1499.999996274594,0,0,0,0,0,0,0,0,0,0,0,0,0,0,0,0,0,0,0,0
SF11E4411350,"Unnamed fire in Valle Hermoso, Tamaulipas, Mexico",499.99999875819805,0,0,0,0,0,0,0,0,0,0,0,0,0,0,0,0,0,0,0,0
SF11E4411351,"Unnamed fire in Columbia-shuswap Regional District, Bc, Canada",499.99999875819805,0,0,0,0,0,0,0,0,0,0,0,0,0,0,0,0,0,0,0,0
SF11E4411352,"Unnamed fire in Caroline County, Maryland",499.99999875819805,0,0,0,0,0,0,0,0,0,0,0,0,0,0,0,0,0,0,0,0
SF11E4411353,"Unnamed fire in Sweetwater County, Wyoming",999.9999975163961,0,0,0,0,0,0,0,0,0,0,0,0,0,0,0,0,0,0,0,0
SF11E4411354,"Unnamed fire in Terrell County, Georgia",499.99999875819805,0,0,0,0,0,0,0,0,0,0,0,0,0,0,0,0,0,0,0,0
SF11E4411355,"Unnamed fire in Natchitoches County, Louisiana",499.99999875819805,0,0,0,0,0,0,0,0,0,0,0,0,0,0,0,0,0,0,0,0
SF11E4411356,"Unnamed fire in Marshall County, Alabama",999.9999975163961,0,0,0,0,0,0,0,0,0,0,0,0,0,0,0,0,0,0,0,0
SF11E4411357,"Unnamed fire in Quitman County, Mississippi",1499.999996274594,0,0,0,0,0,0,0,0,0,0,0,0,0,0,0,0,0,0,0,0
SF11E4411358,"Unnamed fire in Union County, Louisiana",349.99999913073856,0,0,0,0,0,0,0,0,0,0,0,0,0,0,0,0,0,0,0,0
SF11E4411359,"Unnamed fire in Lawrence County, Arkansas",609.9999984850016,0,0,0,0,0,0,0,0,0,0,0,0,0,0,0,0,0,0,0,0
SF11E4411360,"Unnamed fire in Boise County, Idaho",999.9999975163961,0,0,0,0,0,0,0,0,0,0,0,0,0,0,0,0,0,0,0,0
SF11E4411361,"Unnamed fire in Escambia County, Alabama",1749.999995653693,0,0,0,0,0,0,0,0,0,0,0,0,0,0,0,0,0,0,0,0
SF11E4411362,"Unnamed fire in Etchojoa, Sonora, Mexico",999.9999975163961,0,0,0,0,0,0,0,0,0,0,0,0,0,0,0,0,0,0,0,0
SF11E4411363,"Unnamed fire in Las Animas County, Colorado",5249.999986961079,0,0,0,0,0,0,0,0,0,0,0,0,0,0,0,0,0,0,0,0
SF11E4411364,"Unnamed fire in Sabinas, Coahuila, Mexico",499.99999875819805,0,0,0,0,0,0,0,0,0,0,0,0,0,0,0,0,0,0,0,0
SF11E4411365,"Unnamed fire in Gila County, Arizona",15749.999960883237,0,0,0,0,0,0,0,0,0,0,0,0,0,0,0,0,0,0,0,0
SF11E4411366,"Unnamed fire in Duplin County, North Carolina",374.9999990686485,0,0,0,0,0,0,0,0,0,0,0,0,0,0,0,0,0,0,0,0
SF11E4411367,"Unnamed fire in Harnett County, North Carolina",499.99999875819805,0,0,0,0,0,0,0,0,0,0,0,0,0,0,0,0,0,0,0,0
SF11E4411368,"Unnamed fire in Pittsburg County, Oklahoma",499.99999875819805,0,0,0,0,0,0,0,0,0,0,0,0,0,0,0,0,0,0,0,0
SF11E4411369,"Unnamed fire in Robertson County, Tennessee",499.99999875819805,0,0,0,0,0,0,0,0,0,0,0,0,0,0,0,0,0,0,0,0
SF11E4411370,"Unnamed fire in Jones County, Mississippi",1399.9999965229542,0,0,0,0,0,0,0,0,0,0,0,0,0,0,0,0,0,0,0,0
SF11E4411371,"Unnamed fire in Sumter County, Georgia",499.99999875819805,0,0,0,0,0,0,0,0,0,0,0,0,0,0,0,0,0,0,0,0
SF11E4411372,"Unnamed fire in Pesqueria, Nuevo Leon, Mexico",499.99999875819805,0,0,0,0,0,0,0,0,0,0,0,0,0,0,0,0,0,0,0,0
SF11E4411373,"Unnamed fire in Sussex County, Delaware",499.99999875819805,0,0,0,0,0,0,0,0,0,0,0,0,0,0,0,0,0,0,0,0
SF11E4411374,"Unnamed fire in Lee County, Mississippi",699.9999982614771,0,0,0,0,0,0,0,0,0,0,0,0,0,0,0,0,0,0,0,0
SF11E4411375,"Unnamed fire in Rio Bravo, Tamaulipas, Mexico",1499.999996274594,0,0,0,0,0,0,0,0,0,0,0,0,0,0,0,0,0,0,0,0
SF11E4411376,"Unnamed fire in Altamira, Tamaulipas, Mexico",499.99999875819805,0,0,0,0,0,0,0,0,0,0,0,0,0,0,0,0,0,0,0,0
SF11E4411377,"Unnamed fire in Montgomery County, Texas",349.99999913073856,0,0,0,0,0,0,0,0,0,0,0,0,0,0,0,0,0,0,0,0
SF11E4411378,"Unnamed fire in Hamilton County, Texas",499.99999875819805,0,0,0,0,0,0,0,0,0,0,0,0,0,0,0,0,0,0,0,0
SF11E4411379,"Unnamed fire in Lee County, South Carolina",499.99999875819805,0,0,0,0,0,0,0,0,0,0,0,0,0,0,0,0,0,0,0,0
SF11E4411380,"Unnamed fire in Liberty County, Texas",374.9999990686485,0,0,0,0,0,0,0,0,0,0,0,0,0,0,0,0,0,0,0,0
SF11E4411381,"Unnamed fire in Ciudad Del Maiz, San Luis Potosi, Mexico",499.99999875819805,0,0,0,0,0,0,0,0,0,0,0,0,0,0,0,0,0,0,0,0
SF11E4411382,"Unnamed fire in Chester County, Pennsylvania",499.99999875819805,0,0,0,0,0,0,0,0,0,0,0,0,0,0,0,0,0,0,0,0
SF11E4411383,"Unnamed fire in Stanly County, North Carolina",499.99999875819805,0,0,0,0,0,0,0,0,0,0,0,0,0,0,0,0,0,0,0,0
SF11E4411384,"Unnamed fire in Idaho County, Idaho",459.9999988575422,0,0,0,0,0,0,0,0,0,0,0,0,0,0,0,0,0,0,0,0
SF11E4411385,"Unnamed fire in Mcdowell County, North Carolina",609.9999984850016,0,0,0,0,0,0,0,0,0,0,0,0,0,0,0,0,0,0,0,0
SF11E4411386,"Unnamed fire in Jones County, Mississippi",374.9999990686485,0,0,0,0,0,0,0,0,0,0,0,0,0,0,0,0,0,0,0,0
SF11E4411387,"Unnamed fire in Bay County, Michigan",499.99999875819805,0,0,0,0,0,0,0,0,0,0,0,0,0,0,0,0,0,0,0,0
SF11E4411388,"Unnamed fire in Comondu, Baja California Sur, Mexico",499.99999875819805,0,0,0,0,0,0,0,0,0,0,0,0,0,0,0,0,0,0,0,0
SF11E4411389,"Unnamed fire in Jefferson County, Washington",229.9999994287711,0,0,0,0,0,0,0,0,0,0,0,0,0,0,0,0,0,0,0,0
SF11E4411390,"Unnamed fire in Bedford County, Pennsylvania",499.99999875819805,0,0,0,0,0,0,0,0,0,0,0,0,0,0,0,0,0,0,0,0
SF11E4411391,"Unnamed fire in St. Francis County, Arkansas",3499.999991307386,0,0,0,0,0,0,0,0,0,0,0,0,0,0,0,0,0,0,0,0
SF11E4411392,"Unnamed fire in Marshall County, West Virginia",609.9999984850016,0,0,0,0,0,0,0,0,0,0,0,0,0,0,0,0,0,0,0,0
SF11E4411393,"Unnamed fire in Walker County, Alabama",1829.9999954550049,0,0,0,0,0,0,0,0,0,0,0,0,0,0,0,0,0,0,0,0
SF11E4411394,"Unnamed fire in Division No. 19, Ab, Canada",499.99999875819805,0,0,0,0,0,0,0,0,0,0,0,0,0,0,0,0,0,0,0,0
SF11E4411395,"Unnamed fire in Tijuana, Baja California, Mexico",499.99999875819805,0,0,0,0,0,0,0,0,0,0,0,0,0,0,0,0,0,0,0,0
SF11E4411396,"Unnamed fire in Runnels County, Texas",999.9999975163961,0,0,0,0,0,0,0,0,0,0,0,0,0,0,0,0,0,0,0,0
SF11E4411397,"Unnamed fire in Kimble County, Texas",499.99999875819805,0,0,0,0,0,0,0,0,0,0,0,0,0,0,0,0,0,0,0,0
SF11E4411398,"Unnamed fire in Nevada County, Arkansas",1999.9999950327922,0,0,0,0,0,0,0,0,0,0,0,0,0,0,0,0,0,0,0,0
SF11E4411399,"Unnamed fire in Panola County, Mississippi",499.99999875819805,0,0,0,0,0,0,0,0,0,0,0,0,0,0,0,0,0,0,0,0
SF11E4411400,"Unnamed fire in Chesterfield County, South Carolina",1749.999995653693,0,0,0,0,0,0,0,0,0,0,0,0,0,0,0,0,0,0,0,0
SF11E4411401,"Unnamed fire in Lake County, Florida",499.99999875819805,0,0,0,0,0,0,0,0,0,0,0,0,0,0,0,0,0,0,0,0
SF11E4411402,"Unnamed fire in Lawrence County, Alabama",499.99999875819805,0,0,0,0,0,0,0,0,0,0,0,0,0,0,0,0,0,0,0,0
SF11E4411403,"Unnamed fire in Villa De Arista, San Luis Potosi, Mexico",499.99999875819805,0,0,0,0,0,0,0,0,0,0,0,0,0,0,0,0,0,0,0,0
SF11E4411404,"Unnamed fire in Granville County, North Carolina",1219.9999969700032,0,0,0,0,0,0,0,0,0,0,0,0,0,0,0,0,0,0,0,0
SF11E4411405,"Unnamed fire in Yell County, Arkansas",499.99999875819805,0,0,0,0,0,0,0,0,0,0,0,0,0,0,0,0,0,0,0,0
SF11E4411406,"Unnamed fire in Neosho County, Kansas",499.99999875819805,0,0,0,0,0,0,0,0,0,0,0,0,0,0,0,0,0,0,0,0
SF11E4411407,"Unnamed fire in Calhoun County, Alabama",1219.9999969700032,0,0,0,0,0,0,0,0,0,0,0,0,0,0,0,0,0,0,0,0
SF11E4411408,"Unnamed fire in Gonzalez, Tamaulipas, Mexico",499.99999875819805,0,0,0,0,0,0,0,0,0,0,0,0,0,0,0,0,0,0,0,0
SF11E4411409,"Unnamed fire in Box Elder County, Utah",499.99999875819805,0,0,0,0,0,0,0,0,0,0,0,0,0,0,0,0,0,0,0,0
SF11E4411410,"Unnamed fire in West Feliciana County, Louisiana",609.9999984850016,0,0,0,0,0,0,0,0,0,0,0,0,0,0,0,0,0,0,0,0
SF11E4411411,"Unnamed fire in King And Queen County, Virginia",4124.999989755134,0,0,0,0,0,0,0,0,0,0,0,0,0,0,0,0,0,0,0,0
SF11E4411412,"Unnamed fire in Jefferson County, Alabama",609.9999984850016,0,0,0,0,0,0,0,0,0,0,0,0,0,0,0,0,0,0,0,0
SF11E4411413,"Unnamed fire in Jackson County, Louisiana",349.99999913073856,0,0,0,0,0,0,0,0,0,0,0,0,0,0,0,0,0,0,0,0
SF11E4411414,"Unnamed fire in Adair County, Oklahoma",1219.9999969700032,0,0,0,0,0,0,0,0,0,0,0,0,0,0,0,0,0,0,0,0
SF11E4411415,"Unnamed fire in Haskell County, Texas",499.99999875819805,0,0,0,0,0,0,0,0,0,0,0,0,0,0,0,0,0,0,0,0
SF11E4411416,"Unnamed fire in Chester County, Tennessee",499.99999875819805,0,0,0,0,0,0,0,0,0,0,0,0,0,0,0,0,0,0,0,0
SF11E4411417,"Unnamed fire in Marion County, South Carolina",1499.999996274594,0,0,0,0,0,0,0,0,0,0,0,0,0,0,0,0,0,0,0,0
SF11E4411418,"Unnamed fire in Caroline County, Maryland",499.99999875819805,0,0,0,0,0,0,0,0,0,0,0,0,0,0,0,0,0,0,0,0
SF11E4411419,"Unnamed fire in Noxubee County, Mississippi",1999.9999950327922,0,0,0,0,0,0,0,0,0,0,0,0,0,0,0,0,0,0,0,0
SF11E4411420,"Unnamed fire in Panuco, Veracruz, Mexico",999.9999975163961,0,0,0,0,0,0,0,0,0,0,0,0,0,0,0,0,0,0,0,0
SF11E4411421,"Unnamed fire in General Teran, Nuevo Leon, Mexico",499.99999875819805,0,0,0,0,0,0,0,0,0,0,0,0,0,0,0,0,0,0,0,0
SF11E4411422,"Unnamed fire in Taylor County, Texas",999.9999975163961,0,0,0,0,0,0,0,0,0,0,0,0,0,0,0,0,0,0,0,0
SF11E4411423,"Unnamed fire in Butler County, Alabama",1399.9999965229542,0,0,0,0,0,0,0,0,0,0,0,0,0,0,0,0,0,0,0,0
SF11E4411424,"Unnamed fire in Taylor County, Georgia",749.999998137297,0,0,0,0,0,0,0,0,0,0,0,0,0,0,0,0,0,0,0,0
SF11E4411425,"Unnamed fire in Yukon, Yt, Canada",1999.9999950327922,0,0,0,0,0,0,0,0,0,0,0,0,0,0,0,0,0,0,0,0
SF11E4411426,"Unnamed fire in Klickitat County, Washington",1999.9999950327922,0,0,0,0,0,0,0,0,0,0,0,0,0,0,0,0,0,0,0,0
SF11E4411427,"Unnamed fire in Jefferson County, Arkansas",2499.99999379099,0,0,0,0,0,0,0,0,0,0,0,0,0,0,0,0,0,0,0,0
SF11E4411428,"Unnamed fire in Halifax County, Virginia",4879.999987880013,0,0,0,0,0,0,0,0,0,0,0,0,0,0,0,0,0,0,0,0
SF11E4411429,"Unnamed fire in Anderson County, Tennessee",609.9999984850016,0,0,0,0,0,0,0,0,0,0,0,0,0,0,0,0,0,0,0,0
SF11E4411430,"Unnamed fire in Hill County, Texas",499.99999875819805,0,0,0,0,0,0,0,0,0,0,0,0,0,0,0,0,0,0,0,0
SF11E4411431,"Unnamed fire in Adair County, Iowa",499.99999875819805,0,0,0,0,0,0,0,0,0,0,0,0,0,0,0,0,0,0,0,0
SF11E4411432,"Unnamed fire in Acadia County, Louisiana",999.9999975163961,0,0,0,0,0,0,0,0,0,0,0,0,0,0,0,0,0,0,0,0
SF11E4411433,"Unnamed fire in Izard County, Arkansas",609.9999984850016,0,0,0,0,0,0,0,0,0,0,0,0,0,0,0,0,0,0,0,0
SF11E4411434,"Unnamed fire in Marion County, Georgia",349.99999913073856,0,0,0,0,0,0,0,0,0,0,0,0,0,0,0,0,0,0,0,0
SF11E4411435,"Unnamed fire in Bedford County, Virginia",999.9999975163961,0,0,0,0,0,0,0,0,0,0,0,0,0,0,0,0,0,0,0,0
SF11E4411436,"Unnamed fire in Hot Spring County, Arkansas",349.99999913073856,0,0,0,0,0,0,0,0,0,0,0,0,0,0,0,0,0,0,0,0
SF11E4411437,"Unnamed fire in Payne County, Oklahoma",1499.999996274594,0,0,0,0,0,0,0,0,0,0,0,0,0,0,0,0,0,0,0,0
SF11E4411438,"Unnamed fire in Manistee County, Michigan",1829.9999954550049,0,0,0,0,0,0,0,0,0,0,0,0,0,0,0,0,0,0,0,0
SF11E4411439,"Unnamed fire in Pulaski County, Kentucky",499.99999875819805,0,0,0,0,0,0,0,0,0,0,0,0,0,0,0,0,0,0,0,0
SF11E4411440,"Unnamed fire in Camargo, Tamaulipas, Mexico",499.99999875819805,0,0,0,0,0,0,0,0,0,0,0,0,0,0,0,0,0,0,0,0
SF11E4411441,"Unnamed fire in Caroline County, Maryland",999.9999975163961,0,0,0,0,0,0,0,0,0,0,0,0,0,0,0,0,0,0,0,0
SF11E4411442,"Unnamed fire in Duval County, Florida",349.99999913073856,0,0,0,0,0,0,0,0,0,0,0,0,0,0,0,0,0,0,0,0
SF11E4411443,"Unnamed fire in Wilkes County, Georgia",349.99999913073856,0,0,0,0,0,0,0,0,0,0,0,0,0,0,0,0,0,0,0,0
SF11E4411444,"Unnamed fire in Bourbon County, Kansas",999.9999975163961,0,0,0,0,0,0,0,0,0,0,0,0,0,0,0,0,0,0,0,0
SF11E4411445,"Unnamed fire in Gonzalez, Tamaulipas, Mexico",999.9999975163961,0,0,0,0,0,0,0,0,0,0,0,0,0,0,0,0,0,0,0,0
SF11E4411446,"Unnamed fire in Morgan County, Alabama",1219.9999969700032,0,0,0,0,0,0,0,0,0,0,0,0,0,0,0,0,0,0,0,0
SF11E4411447,"Unnamed fire in Howell County, Missouri",1999.9999950327922,0,0,0,0,0,0,0,0,0,0,0,0,0,0,0,0,0,0,0,0
SF11E4411448,"Unnamed fire in Kalkaska County, Michigan",1219.9999969700032,0,0,0,0,0,0,0,0,0,0,0,0,0,0,0,0,0,0,0,0
SF11E4411449,"Unnamed fire in Algoma District, On, Canada",499.99999875819805,0,0,0,0,0,0,0,0,0,0,0,0,0,0,0,0,0,0,0,0
SF11E4411450,"Unnamed fire in St. Clair County, Michigan",499.99999875819805,0,0,0,0,0,0,0,0,0,0,0,0,0,0,0,0,0,0,0,0
SF11E4411451,"Unnamed fire in Stephens County, Oklahoma",749.999998137297,0,0,0,0,0,0,0,0,0,0,0,0,0,0,0,0,0,0,0,0
SF11E4411452,"Unnamed fire in Brazoria County, Texas",374.9999990686485,0,0,0,0,0,0,0,0,0,0,0,0,0,0,0,0,0,0,0,0
SF11E4411453,"Unnamed fire in Tallapoosa County, Alabama",1219.9999969700032,0,0,0,0,0,0,0,0,0,0,0,0,0,0,0,0,0,0,0,0
SF11E4411454,"Unnamed fire in Stone County, Mississippi",374.9999990686485,0,0,0,0,0,0,0,0,0,0,0,0,0,0,0,0,0,0,0,0
SF11E4411455,"Unnamed fire in Montgomery County, Mississippi",1219.9999969700032,0,0,0,0,0,0,0,0,0,0,0,0,0,0,0,0,0,0,0,0
SF11E4411456,"Unnamed fire in Maury County, Tennessee",1829.9999954550049,0,0,0,0,0,0,0,0,0,0,0,0,0,0,0,0,0,0,0,0
SF11E4411457,"Unnamed fire in Cumberland County, Tennessee",609.9999984850016,0,0,0,0,0,0,0,0,0,0,0,0,0,0,0,0,0,0,0,0
SF11E4411458,"Unnamed fire in Putnam County, Georgia",609.9999984850016,0,0,0,0,0,0,0,0,0,0,0,0,0,0,0,0,0,0,0,0
SF11E4411459,"Unnamed fire in Morrison County, Minnesota",499.99999875819805,0,0,0,0,0,0,0,0,0,0,0,0,0,0,0,0,0,0,0,0
SF11E4411460,"Unnamed fire in Perry County, Kentucky",1219.9999969700032,0,0,0,0,0,0,0,0,0,0,0,0,0,0,0,0,0,0,0,0
SF11E4411461,"Unnamed fire in Manatee County, Florida",1999.9999950327922,0,0,0,0,0,0,0,0,0,0,0,0,0,0,0,0,0,0,0,0
SF11E4411462,"Unnamed fire in Madison County, Florida",499.99999875819805,0,0,0,0,0,0,0,0,0,0,0,0,0,0,0,0,0,0,0,0
SF11E4411463,"Unnamed fire in Phillips County, Arkansas",3999.999990065584,0,0,0,0,0,0,0,0,0,0,0,0,0,0,0,0,0,0,0,0
SF11E4411464,"Unnamed fire in Franklin County, Pennsylvania",499.99999875819805,0,0,0,0,0,0,0,0,0,0,0,0,0,0,0,0,0,0,0,0
SF11E4411465,"Unnamed fire in Lancaster County, Pennsylvania",499.99999875819805,0,0,0,0,0,0,0,0,0,0,0,0,0,0,0,0,0,0,0,0
SF11E4411466,"Unnamed fire in Francheville, Qc, Canada",499.99999875819805,0,0,0,0,0,0,0,0,0,0,0,0,0,0,0,0,0,0,0,0
SF11E4411467,"Unnamed fire in Blount County, Alabama",609.9999984850016,0,0,0,0,0,0,0,0,0,0,0,0,0,0,0,0,0,0,0,0
SF11E4411468,"Unnamed fire in Scott County, Kansas",499.99999875819805,0,0,0,0,0,0,0,0,0,0,0,0,0,0,0,0,0,0,0,0
SF11E4411469,"Unnamed fire in Lamar County, Alabama",374.9999990686485,0,0,0,0,0,0,0,0,0,0,0,0,0,0,0,0,0,0,0,0
SF11E4411470,"Unnamed fire in Maury County, Tennessee",499.99999875819805,0,0,0,0,0,0,0,0,0,0,0,0,0,0,0,0,0,0,0,0
SF11E4411471,"Unnamed fire in Logan County, Kentucky",1219.9999969700032,0,0,0,0,0,0,0,0,0,0,0,0,0,0,0,0,0,0,0,0
SF11E4411472,"Unnamed fire in Tulare County, California",919.9999977150844,0,0,0,0,0,0,0,0,0,0,0,0,0,0,0,0,0,0,0,0
SF11E4411473,"Unnamed fire in Jefferson County, Mississippi",349.99999913073856,0,0,0,0,0,0,0,0,0,0,0,0,0,0,0,0,0,0,0,0
SF11E4411474,"Unnamed fire in Clay County, Georgia",499.99999875819805,0,0,0,0,0,0,0,0,0,0,0,0,0,0,0,0,0,0,0,0
SF11E4411475,"Unnamed fire in Villa De Arista, San Luis Potosi, Mexico",1499.999996274594,0,0,0,0,0,0,0,0,0,0,0,0,0,0,0,0,0,0,0,0
SF11E4411476,"Unnamed fire in Warren County, Iowa",499.99999875819805,0,0,0,0,0,0,0,0,0,0,0,0,0,0,0,0,0,0,0,0
SF11E4411477,"Unnamed fire in Houston County, Tennessee",609.9999984850016,0,0,0,0,0,0,0,0,0,0,0,0,0,0,0,0,0,0,0,0
SF11E4411478,"Unnamed fire in Wexford County, Michigan",2499.99999379099,0,0,0,0,0,0,0,0,0,0,0,0,0,0,0,0,0,0,0,0
SF11E4411479,"Unnamed fire in Bradley County, Arkansas",699.9999982614771,0,0,0,0,0,0,0,0,0,0,0,0,0,0,0,0,0,0,0,0
SF11E4411480,"Unnamed fire in Huron County, On, Canada",499.99999875819805,0,0,0,0,0,0,0,0,0,0,0,0,0,0,0,0,0,0,0,0
SF11E4411481,"Unnamed fire in San Joaquin County, California",1499.999996274594,0,0,0,0,0,0,0,0,0,0,0,0,0,0,0,0,0,0,0,0
SF11E4411482,"Unnamed fire in Butte County, California",2499.99999379099,0,0,0,0,0,0,0,0,0,0,0,0,0,0,0,0,0,0,0,0
SF11E4411483,"Unnamed fire in Saltillo, Coahuila, Mexico",499.99999875819805,0,0,0,0,0,0,0,0,0,0,0,0,0,0,0,0,0,0,0,0
SF11E4411484,"Unnamed fire in Mobile County, Alabama",5599.999986091818,0,0,0,0,0,0,0,0,0,0,0,0,0,0,0,0,0,0,0,0
SF11E4411485,"Unnamed fire in Pitt County, North Carolina",349.99999913073856,0,0,0,0,0,0,0,0,0,0,0,0,0,0,0,0,0,0,0,0
SF11E4411486,"Unnamed fire in Outagamie County, Wisconsin",499.99999875819805,0,0,0,0,0,0,0,0,0,0,0,0,0,0,0,0,0,0,0,0
SF11E4411487,"Unnamed fire in Wellington County, On, Canada",499.99999875819805,0,0,0,0,0,0,0,0,0,0,0,0,0,0,0,0,0,0,0,0
SF11E4411488,"Unnamed fire in Hill County, Texas",499.99999875819805,0,0,0,0,0,0,0,0,0,0,0,0,0,0,0,0,0,0,0,0
SF11E4411489,"Unnamed fire in Division No.  5, Ab, Canada",499.99999875819805,0,0,0,0,0,0,0,0,0,0,0,0,0,0,0,0,0,0,0,0
SF11E4411490,"Unnamed fire in Bolivar County, Mississippi",9499.999976405763,0,0,0,0,0,0,0,0,0,0,0,0,0,0,0,0,0,0,0,0
SF11E4411491,"Unnamed fire in Hamblen County, Tennessee",499.99999875819805,0,0,0,0,0,0,0,0,0,0,0,0,0,0,0,0,0,0,0,0
SF11E4411492,"Unnamed fire in Angostura, Sinaloa, Mexico",999.9999975163961,0,0,0,0,0,0,0,0,0,0,0,0,0,0,0,0,0,0,0,0
SF11E4411493,"Unnamed fire in Gratiot County, Michigan",499.99999875819805,0,0,0,0,0,0,0,0,0,0,0,0,0,0,0,0,0,0,0,0
SF11E4411494,"Unnamed fire in Adams County, Mississippi",609.9999984850016,0,0,0,0,0,0,0,0,0,0,0,0,0,0,0,0,0,0,0,0
SF11E4411495,"Unnamed fire in Clay County, Alabama",609.9999984850016,0,0,0,0,0,0,0,0,0,0,0,0,0,0,0,0,0,0,0,0
SF11E4411496,"Unnamed fire in Lincoln County, Mississippi",349.99999913073856,0,0,0,0,0,0,0,0,0,0,0,0,0,0,0,0,0,0,0,0
SF11E4411497,"Unnamed fire in Humphreys County, Mississippi",999.9999975163961,0,0,0,0,0,0,0,0,0,0,0,0,0,0,0,0,0,0,0,0
SF11E4411498,"Unnamed fire in East Carroll County, Louisiana",2999.999992549188,0,0,0,0,0,0,0,0,0,0,0,0,0,0,0,0,0,0,0,0
SF11E4411499,"Unnamed fire in Tensas County, Louisiana",499.99999875819805,0,0,0,0,0,0,0,0,0,0,0,0,0,0,0,0,0,0,0,0
SF11E4411500,"Unnamed fire in Morehouse County, Louisiana",499.99999875819805,0,0,0,0,0,0,0,0,0,0,0,0,0,0,0,0,0,0,0,0
SF11E4411501,"Unnamed fire in Bradley County, Tennessee",499.99999875819805,0,0,0,0,0,0,0,0,0,0,0,0,0,0,0,0,0,0,0,0
SF11E4411502,"Unnamed fire in Franklin County, Washington",3499.999991307386,0,0,0,0,0,0,0,0,0,0,0,0,0,0,0,0,0,0,0,0
SF11E4411503,"Unnamed fire in Chambers County, Texas",999.9999975163961,0,0,0,0,0,0,0,0,0,0,0,0,0,0,0,0,0,0,0,0
SF11E4411504,"Unnamed fire in Division No. 16, Sk, Canada",499.99999875819805,0,0,0,0,0,0,0,0,0,0,0,0,0,0,0,0,0,0,0,0
SF11E4411505,"Unnamed fire in Jackson County, Colorado",499.99999875819805,0,0,0,0,0,0,0,0,0,0,0,0,0,0,0,0,0,0,0,0
SF11E4411506,"Unnamed fire in Arkansas County, Arkansas",499.99999875819805,0,0,0,0,0,0,0,0,0,0,0,0,0,0,0,0,0,0,0,0
SF11E4411507,"Unnamed fire in Berks County, Pennsylvania",499.99999875819805,0,0,0,0,0,0,0,0,0,0,0,0,0,0,0,0,0,0,0,0
SF11E4411508,"Unnamed fire in Lafayette County, Mississippi",699.9999982614771,0,0,0,0,0,0,0,0,0,0,0,0,0,0,0,0,0,0,0,0
SF11E4411509,"Unnamed fire in Soto La Marina, Tamaulipas, Mexico",499.99999875819805,0,0,0,0,0,0,0,0,0,0,0,0,0,0,0,0,0,0,0,0
SF11E4411510,"Unnamed fire in Cherokee County, Texas",349.99999913073856,0,0,0,0,0,0,0,0,0,0,0,0,0,0,0,0,0,0,0,0
SF11E4411511,"Unnamed fire in Cullman County, Alabama",499.99999875819805,0,0,0,0,0,0,0,0,0,0,0,0,0,0,0,0,0,0,0,0
SF11E4411512,"Unnamed fire in Gibson County, Tennessee",1499.999996274594,0,0,0,0,0,0,0,0,0,0,0,0,0,0,0,0,0,0,0,0
